results/gridflow_2025_scenario_comparison.csv

Scenario,Operating Cost (#b),Gas Generation (TWh),Biomass Generation (TWh),Total Renewable Curtailment (TWh),Average Marginal Price (#/MWh),Battery Discharge (TWh)
A - Baseline,6.2093664805,63.8542245,0.011929,0.0001243,71.12813926940639,
B - 1.5x Renewables,3.78962009775,34.9759685,0.00163975,0.899329625,47.46917808219178,
C - 1.5x Renewables + Battery,3.726813267280251,34.092787441249996,0.0,0.8295396054016619,47.79664261975233,1.0986715268750002

README.md

### Main Findings

- Modelled operating costs reduced by nearly **40%** from £6.21 billion to £3.79 billion
- Gas generation was reduced by approximately **45%** from nearly 64 TWh to nearly 35 TWh
- Average marginal price proxy was reduced by nearly **33%** from nearly £71/MWh to £47.50/MWh
- However, nearly 0.90 TWh of renewable availability was curtailed.

Implementing the 2GW/4GWh battery produced further improvements;
- Operating costs fell further
- Gas generation fell by another **0.88 TWh**
- Renewable curtailment from by nearly 8% from 0.899 TWh to 0.830 TWh
- Modelled biomass generation was eliminated entirely
- Battery Discharged nearly **1.10 TWh** over the year